course_code,semester,day_and_period,course_name_jp,capacity,type_of_class,credits,student_year,instructor,course_of_media_class,course_subtitle,language_of_the_course,learning_methods,course_objectives,learning_goals,requirements_prerequisites,attendance_and_student_conduct_policy,class_plan,textbooks,reference,grading_policy,additional_information_on_grading,special_note,office_hours,course_conducted_by_instructors_with_practical_experience
05A011,通年,他,MD研究者育成プログラム,0,"講義科目,実習科目",18.0,"1,2,3,4,5,6年","渡部　健二,河盛　段,佐田　遼太",非該当,研究テーマは、学生が所属する研究室で指示される。,日本語,調査: 本や論文から情報を収集したり、フィールドワークでデータを収集・分析して学ぶ（例：先行研究整理、フィールドワーク）体験・実践: 体験・実践等の行動ならびにそれに対するフィードバックにより学ぶ（例：問題演習、機器等を使う実験、学内外実習、スポーツ等の実技、課題解決型学習、インターンシップ）発表: 執筆、プレゼンテーション、作品制作等により学ぶ（例：レポート作成、プレゼンテーション、ポスター発表、作品制作、ポートフォリオ）,詳細は医学科HPを参照すること。将来の基礎医学研究者を育成することを目的とし、学生が希望する基礎医学系研究室に所属して研究活動を実践し、研究者としての基本的能力を養なう特別プログラムである。,1・研究課題を解決する方法を自ら考え、研究計画を作成できる。・研究手技を理解し、実行できる・研究結果を英語でまとめ、発表できる。・研究課題に関連した英文論文を読み、理解できる。,医学科学生のうち、本プログラムへの参加を希望し、受け入れ教室からの了承がえられたもの。,,時限: 曜日:題目:所属教室で授業計画が作成される、年度初めに研究進捗状況の確認を行う担当教員：授業時間外学習：詳細は各所属研究室から指示されるが、研究テーマに関する論文を積極的に読んで、研究への理解を深めること。,所属研究室から指示される。,所属研究室から指示される。,評価方法／Evaluation Methods学習目標1・研究課題を解決する方法を自ら考え、研究計画を作成できる。・研究手技を理解し、実行できる・研究結果を英語でまとめ、発表できる。・研究課題に関連した英文論文を読み、理解できる。評価割合（%）／Allocation of Marks,1）原則として６年次までの医学研究継続実績があること。2）６年次に公開の研究発表を行い、所属研究室の教授から修了判定が得られること。,,,医師としての診療経験、かつ基礎医学研究の実務経験のある教員がプログラム全般を統轄、指導する。
05A016,春～夏学期,金4,データサイエンスA,0,講義科目,2.0,2年,渡部　健二,非該当,,日本語,聴講・視聴: 講義・教材・実演を視聴して学ぶ（例：講義の対面受講、オンデマンド教材視聴）討論: 学生同士や教員との間で質疑応答や意見交換を行うことで学ぶ（例：ペア・グループディスカッション、オンラインでのチャット、論文個別指導）体験・実践: 体験・実践等の行動ならびにそれに対するフィードバックにより学ぶ（例：問題演習、機器等を使う実験、学内外実習、スポーツ等の実技、課題解決型学習、インターンシップ）,データサイエンスBでは生命科学におけるデータサイエンスの具体的な応用事例を体験するので、その準備としてデータサイエンスの基礎を学ぶ,,パソコンで演習するため、パソコンの基本的な操作方法は共通教育などで修得しておくこと,授業開始時に教室内にいない場合、欠席とみなします。ただし、感染症や忌引等のやむを得ない理由の場合は履修上不利益とならないよう配慮します。,第1回2025年4月4日 時限:13:00-14:30 曜日:金曜日題目:講義第1回＠CoMIT1階マルチメディアホール「医療情報におけるデータサイエンス活用事例」担当教員：授業時間外学習：第2回2025年4月11日 時限:13:00-14:30 曜日:金曜日題目:講義第2回「データサイエンス活用事例に基づく学生による起業」担当教員：授業時間外学習：第3回2025年4月18日 時限:13:00-14:30 曜日:金曜日題目:講義第3回「放射線科診断におけるデータサイエンス活用事例」担当教員：授業時間外学習：第4回2025年4月25日 時限:13:00-14:30 曜日:金曜日題目:講義第4回「公衆衛生領域を中心としたデータサイエンス活用事例」担当教員：授業時間外学習：第5回2025年5月9日 時限:13:00-14:30 曜日:金曜日題目:演習第1回「導入」ガイダンス，環境整備，データ構造の基本担当教員：授業時間外学習：第6回2025年5月16日 時限:13:00-14:30 曜日:金曜日題目:演習第2回「基本的なプログラミング」フローチャート，簡単な実例・実装（素数判定，基数変換，おつりの計算）担当教員：授業時間外学習：第7回2025年5月23日 時限:13:00-14:30 曜日:金曜日題目:演習第3回「計算量とデータ構造，探索」計算コスト，データ構造，線形探索，二分探索担当教員：授業時間外学習：第8回2025年5月30日 時限:13:00-14:30 曜日:金曜日題目:演習第4回「基本的な探索法」ツリー探索，様々な探索法の実装（8クィーン問題，ハノイの塔）担当教員：授業時間外学習：第9回2025年6月6日 時限:13:00-14:30 曜日:金曜日題目:演習第5回「基本的なソート」ソートの基本，選択ソート，挿入ソート，バブルソート，ヒープソート担当教員：授業時間外学習：第10回2025年6月13日 時限:13:00-14:30 曜日:金曜日題目:演習第6回「アルゴリズム基礎」グラフ理論，最短経路問題，文字列検索（照合）担当教員：授業時間外学習：第11回2025年6月20日 時限:13:00-14:30 曜日:金曜日題目:演習第7回「データ処理の基本」成績の処理（配列，総和，平均，結果の可視化，分散・誤差）担当教員：授業時間外学習：第12回2025年6月27日 時限:13:00-14:30 曜日:金曜日題目:演習第8回「簡単なゲームプログラミング」ライフゲーム担当教員：授業時間外学習：第13回2025年7月4日 時限:13:00-14:30 曜日:金曜日題目:演習第9回「物理シミュレーション」放物線のシミュレーション担当教員：授業時間外学習：第14回2025年7月11日 時限:13:00-14:30 曜日:金曜日題目:演習第10回「統計学的仮説検定」（この授業のみ医学部講義棟E講堂、他はすべてCoMIT1階マルチメディアホール）統計学的仮説検定，ｐ値の計算，モンテカルロ法担当教員：授業時間外学習：第15回2025年7月18日 時限:13:00-14:30 曜日:金曜日題目:演習第11回「大規模データの検索と情報抽出」大規模データの検索，併合整列法，高度な検索（ゲノム解析），データ分類担当教員：授業時間外学習：,,,,演習で課題を提出してもらいます、その積み上げにより成績評価を行います。,,,
05A017,秋～冬学期,"月4,月5,月6,水1,水2,水3,他",データサイエンスB,0,講義科目,1.0,2年,"河原　行郎,中島　悠太,谷内田　真一,武部　貴則,加藤　有己,白井　雄也,十時　泰",非該当,データサイエンスB,日本語,聴講・視聴: 講義・教材・実演を視聴して学ぶ（例：講義の対面受講、オンデマンド教材視聴）体験・実践: 体験・実践等の行動ならびにそれに対するフィードバックにより学ぶ（例：問題演習、機器等を使う実験、学内外実習、スポーツ等の実技、課題解決型学習、インターンシップ）データサイエンスAで学んだPythonを使って、実際のデータ解析を体験する。,近年、医学研究や医療現場でデータ解析の必要性が高まっている。研究では、次世代シーケンサーを使ったRNA発現解析、シングルセルRNA発現解析、空間トランスクリプトーム (空間遺伝子発現）解析、ゲノムDNAを用いた遺伝子変異解析などがあげられる。また、臨床の現場でも、AIを駆使した病理画像やCT/MRI画像の診断などが行われつつある。こうした状況に対応するため、プログラミングを基盤としたデータ解析の実例を体験し、その必要性を理解することを目的とする。,1Pythonを使ったデータ解析を、いくつかのモデルデータを使ってできるようになる。,,,第1回20251117 時限:4-6 曜日:月題目:概要説明・RNA発現解析実習１遺伝子発現解析（予定）担当教員：河原・加藤授業時間外学習：実習前後に予習と復習をすることがのぞまれる。第2回20251126 時限:1-3 曜日:水題目:RNA発現解析実習2シングルセル解析（予定）担当教員：加藤授業時間外学習：第3回20251201 時限:4-6 曜日:月題目:ゲノム解析実習1担当教員：十時授業時間外学習：第4回20251203 時限:1-3 曜日:水題目:ゲノム解析実習2担当教員：十時授業時間外学習：第5回20251208 時限:4-6 曜日:月題目:RNA発現解析実習3空間発現解析（予定）担当教員：中谷授業時間外学習：第6回20251210 時限:1-3 曜日:水題目:RNA発現解析実習4空間発現解析（予定）担当教員：中谷授業時間外学習：第7回20251215 時限:4-6 曜日:月題目:画像解析実習1Image Jを使った基礎解析担当教員：横田・竹本・道川授業時間外学習：第8回20251217 時限:1-3 曜日:水題目:画像解析実習2AIを使ったアドバンスト解析担当教員：中島授業時間外学習：第9回20260126 時限:未定 曜日:月題目:テスト・補習テスト・補習担当教員：河原・加藤授業時間外学習：,,,評価方法／Evaluation Methodsレポート・論文学習目標1Pythonを使ったデータ解析を、いくつかのモデルデータを使ってできるようになる。○評価割合（%）／Allocation of Marks100%,各実習中に課題を出します。実習中または実習後に課題を解く、またはレポートにまとめて提出していただきます。全実習で１００点とし、６０点以上を合格とします。出欠はとらない方針ですが、出席しないと課題を提出出来ませんので、注意してください。インフルエンザなどで休む場合は、診断書を提出してください。公休が認められた場合は、２０２６年１月２６日に実施する試験で不足分を補ってください。,,,
051122,春～夏学期,金4,医学序説,0,講義科目,2.0,1年,渡部　健二,非該当,配布資料を参照すること,日本語,聴講・視聴: 講義・教材・実演を視聴して学ぶ（例：講義の対面受講、オンデマンド教材視聴）,入学間もない医学科学生に、医学への興味と動機を引き立てることを目的とする。学内外の第一線で活躍中の研究者による特別講義と、臨床系教授による先端医療の話題を中心とした講義から構成される。,1学生諸君が、基礎医学研究から最新の臨床医学までのさまざまな分野の講義に接することで、医学への興味と関心を高め、将来のあるべき医師像について考えてもらうことを目標とする。,,,第1回時限: 曜日:題目:オムニバス形式で、毎回演者が変わる。詳しくは初日に説明する。授業日程は、4/11-7/25。担当教員：授業時間外学習：講義で得た興味のあるテーマをさらに自分で調査して、理解を深めていただきたい。,,,評価方法／Evaluation Methodsレポート・論文学習目標1学生諸君が、基礎医学研究から最新の臨床医学までのさまざまな分野の講義に接することで、医学への興味と関心を高め、将来のあるべき医師像について考えてもらうことを目標とする。○評価割合（%）／Allocation of Marks100%,,,,
050149,春～夏学期,火4,医学概論,150,講義科目,1.0,3年,"加藤　和人,林　令奈,古結　敦士,磯野　萌子",非該当,,日本語,聴講・視聴: 講義・教材・実演を視聴して学ぶ（例：講義の対面受講、オンデマンド教材視聴）討論: 学生同士や教員との間で質疑応答や意見交換を行うことで学ぶ（例：ペア・グループディスカッション、オンラインでのチャット、論文個別指導）発表: 執筆、プレゼンテーション、作品制作等により学ぶ（例：レポート作成、プレゼンテーション、ポスター発表、作品制作、ポートフォリオ）,医学概論は、「医学とは何か」を、歴史的、社会文化的な広がりの中で、また他の学問分野との関連の中で明らかにし、理解することを目的としている。本学医学部の医学概論講義は、科学・生命・医学を反省することを使命として開講され、半世紀を越える歴史を有している。講義は医学上の個々の知識の習得自体を求めるものではない。しかし、概論とは名付けられたものの、医学の一般的な、概括的な知識の集合でもない。医学概論の方法は、医哲学、医学史、医療倫理学、医療社会学、医療政策論など多岐にわたるが、医学が本来内包している社会との関わりに焦点をあて、総合的・学際的に「医学とは何か」を研究しようとしている点に特徴がある。具体的なテーマとしては、終末期医療やヒトゲノム・遺伝子解析研究や幹細胞研究などを取り上げながら、医療行為、医学・生命科学研究、医療関連ビジネス、医療政策といった様々な現場において生じる倫理的・社会的な課題について学ぶ。それらの課題は、〈生命〉〈情報〉〈身体〉〈死〉〈苦しみ〉〈ケア〉などを「どのようなものとして理解するのか」という問いと切り離すことができないと同時に、医学や医療の現場における規範の形成と実施という課題にも繋がっていく。講義を通じて、受講者は現代社会における医学・医療の発展に伴う諸問題を多様な視点から整理・分析し、あるべき対応を検討する姿勢を習得してもらいたい。,1医学・医療と社会との関わりについて自らの中に問題意識を根付かせることができる。問題に主体的に取り組む思考を深め、現代社会における医学・医療の発展に伴う諸問題を多様な視点から整理・分析し、あるべき対応を検討する姿勢を習得できる。,特に無し,,第1回2025/4/8 時限:4限 曜日:火題目:イントロダクション担当教員：加藤 和人授業時間外学習：第2回2025/4/15 時限:4限 曜日:火題目:臨床倫理担当教員：古結 敦士授業時間外学習：第3回2025/5/13 時限:4限 曜日:火題目:遺伝子（ゲノム）医療の倫理的・社会的課題担当教員：加藤 和人授業時間外学習：第4回2025/5/20 時限:4限 曜日:火題目:未熟児網膜症事件担当教員：阿部 隆徳授業時間外学習：第5回2025/5/27 時限:4限 曜日:火題目:患者の立場から見た医療担当教員：加藤 和人　他授業時間外学習：第6回2025/6/3 時限:4限 曜日:火題目:失明は不幸なのかーー視覚障害者発の触文化展が問いかける「光」の意味担当教員：広瀬 浩二郎授業時間外学習：第7回2025/6/10 時限:4限 曜日:火題目:患者参画担当教員：古結 敦士授業時間外学習：第8回2025/6/17 時限:4限 曜日:火題目:生殖医療と生命倫理担当教員：苛原 稔授業時間外学習：第9回2025/7/1 時限:4限 曜日:火題目:行政からみた「大阪の健康・医療」担当教員：西野 誠授業時間外学習：第10回2025/7/8 時限:4限 曜日:火題目:人を対象に研究するということ担当教員：鈴木 美香授業時間外学習：第11回2025/7/15 時限:4限 曜日:火題目:再生医療と医療システム担当教員：高橋 政代授業時間外学習：第12回2025/7/22 時限:4限 曜日:火題目:社会における医学と医療担当教員：加藤 和人授業時間外学習：,講義の際に教材として資料を配布する。,"【加藤和人先生　担当回】「生命科学の倫理と科学コミュニケーション-日本の課題と科学研究コミュニティへの期待」位田隆一・片井修・水谷雅彦・矢野智司編 『倫理への問いと大学の使命』（京都大学学術出版会）pp. 119-131, 2010「ゲノムと社会・倫理」浅島誠・黒岩常祥・小原雄治編『ゲノム科学の展開』現代生物科学入門第2巻（岩波書店）pp. 137-163, 2011",評価方法／Evaluation Methods学習への参加度レポート・論文学習目標1医学・医療と社会との関わりについて自らの中に問題意識を根付かせることができる。問題に主体的に取り組む思考を深め、現代社会における医学・医療の発展に伴う諸問題を多様な視点から整理・分析し、あるべき対応を検討する姿勢を習得できる。○○評価割合（%）／Allocation of Marks20%80%,（1）試験について・試験に代えて、レポートの提出を課す。その結果に基づいて厳格に判定する。（2） 出席について・出席は、講義中に配布する感想用紙の記載および提出、あるいはオンライン講義中でのチャットやりとりにより確認する。・全講義回数の2/3以上の講義参加があった者を採点の対象とする。（３）合否について・上記を満たさない者は不合格となる。,積極的な聴講を望む。講義中の質問は大いに歓迎する。,,
051147,春～夏学期,金5,基礎医学体験実習,0,実習科目,1.0,1年,"渡部　健二,河盛　段,佐田　遼太",非該当,配布資料を参照すること。,日本語,聴講・視聴: 講義・教材・実演を視聴して学ぶ（例：講義の対面受講、オンデマンド教材視聴）体験・実践: 体験・実践等の行動ならびにそれに対するフィードバックにより学ぶ（例：問題演習、機器等を使う実験、学内外実習、スポーツ等の実技、課題解決型学習、インターンシップ）,合計8週間の基礎医学教室による研究紹介を通じて、医学部基礎医学教室がどのような研究を行っているか概要を理解し、6週間は各研究室に配属され基礎医学研究とはどういうものであるかを現場で体験する。,1医学部における基礎医学研究の意義を理解し、説明できる。,,,時限: 曜日:題目:4週間連続の講義の後、前半実習（教室配属①）を2週間実施、その後4週間連続の講義を行い、2週間の後半実習（教室配属②）。最後の2週間は、希望者が希望講座で2週間の教室配属実習③に参加する。担当教員：授業時間外学習：実習で得た興味のあるテーマをさらに自分で調査して、理解を深めていただきたい。,設定しない。,設定しない。,評価方法／Evaluation Methods学習目標1医学部における基礎医学研究の意義を理解し、説明できる。評価割合（%）／Allocation of Marks,実習への参加態度（出席状況や実習への貢献、積極的な取り組み姿勢など）およびレポートにより合否を判定する。レポートでは自身の体験から感じた基礎医学研究の意義、本実習の感想を述べること。,,,医師としての診療実績を有する教員が、基礎医学研究に係る実習指導を行う。
05A008,集中,他,基礎医学講座配属,0,実習科目,8.0,3年,"渡部　健二,河盛　段,佐田　遼太",非該当,各所属講座で研究テーマが決定される。,日本語・英語,読解: 本や論文を読解して学ぶ（例：論文要約、ウェブ情報の読解）討論: 学生同士や教員との間で質疑応答や意見交換を行うことで学ぶ（例：ペア・グループディスカッション、オンラインでのチャット、論文個別指導）協同: ペアやグループで行う協同作業を通して学ぶ（例：グループによるポスター制作）調査: 本や論文から情報を収集したり、フィールドワークでデータを収集・分析して学ぶ（例：先行研究整理、フィールドワーク）体験・実践: 体験・実践等の行動ならびにそれに対するフィードバックにより学ぶ（例：問題演習、機器等を使う実験、学内外実習、スポーツ等の実技、課題解決型学習、インターンシップ）発表: 執筆、プレゼンテーション、作品制作等により学ぶ（例：レポート作成、プレゼンテーション、ポスター発表、作品制作、ポートフォリオ）,大阪大学医学部医学科の使命の一つである「研究者の養成」に則り、基礎医学分野を学修した後に行われる。各学生はこの間、医学研究を実施する能力を養うべく、これまで学んできた医学知識を応用し、目的意識を持って基礎医学に関する研究活動を行う。,1基礎医学研究に参加することで、研究者としての基礎となる能力を修得する。・計画に従って研究を進行できる。・研究手技を正しく実行し、データを得る。・自分が行った研究の発表、関連文献の理解、討議ができる。・医学研究の意義を理解する。,,,60時限: 曜日:題目:事前に教育訓練（CLE）と研究倫理（APRIN）を受講すること、初日午前中にイントロダクションとして研究倫理および文献検索方法についての授業を行い、午後から実習開始となる担当教員：授業時間外学習：研究テーマに関する論文をしっかり読み、より理解を深めること。,設定しない。,設定しない。,評価方法／Evaluation Methods学習への参加度発表学習目標1基礎医学研究に参加することで、研究者としての基礎となる能力を修得する。・計画に従って研究を進行できる。・研究手技を正しく実行し、データを得る。・自分が行った研究の発表、関連文献の理解、討議ができる。・医学研究の意義を理解する。○○評価割合（%）／Allocation of Marks50%50%,配属先講座での研究参加状況、研究発表会での発表内容をそれぞれ50点（合計100点）で評価する。そのうえで、実習時の研究への姿勢、態度を総合的に判断して、最終的な合否を判定する。,,,医学研究に関する実績ある教員が、基礎医学研究に係る実習指導を行う。
