course_code,semester,day_and_period,course_name_jp,capacity,type_of_class,credits,student_year,instructor,course_of_media_class,course_subtitle,language_of_the_course,learning_methods,course_objectives,learning_goals,requirements_prerequisites,attendance_and_student_conduct_policy,class_plan,textbooks,reference,grading_policy,additional_information_on_grading,special_note,office_hours,course_conducted_by_instructors_with_practical_experience
090619(知のジムナスティックス科目),冬学期,月3,生体工学Ｂ,0,講義科目,1.0,"3,4年",出口　真次,非該当,生体工学B,日本語,聴講・視聴: 講義・教材・実演を視聴して学ぶ（例：講義の対面受講、オンデマンド教材視聴）,本講義では、前半（生命編・3回）と後半（力学編・4回）にわけて大きく異なるトピックを扱う。複雑な生命現象の背後にある「原理」となる概念（進化の仕組み、自己組織化の仕組み、力学の原理と微分方程式の導出）を学び、その理解が幅広い応用につながることを実感する。講義では下記の主題について扱う。生命の適応と複雑性：生命と非生命の違いを物理化学的観点から理解することを目的とします．生命について理解することは，物理学に対する見方や，ひいては人生観・価値観・世界観にも影響を及ぼすものだと思います．具体的には，生命による環境への適応，をキーワードとして，特に二種類の適応（進化における適応，および，適応的応答）の違いと共通点，および適応するための必要条件について述べる．また，その十分条件に関する考察を通して，アンドロイドなどの機械・非生命と生命との違いを浮き彫りにする．生命の適応について学ぶことは，心理学で観察されてきた諸現象や，哲学・現代思想における構造主義と通じるものがあることに気づくかもしれません．それにより自分を含む生命や人間の普遍的な思考方法とは何であるか，感情の起源を考えられるようになり，ひいては心から謙虚になれるなど生きていくためのヒントが得られるかもしれません．発声のしくみ・力学を俯瞰的に眺める：生体のモデル化の方法を考えるとともに、これまでに学んだ力学の基礎を改めて見直すとともに応用的側面を考え、それらの学問がどのように複雑な問題の解析に役立てられるのかを学ぶことを目的とする。なお、本講義で基礎となる学問は、熱力学、流体力学、固体力学、振動学、波動学、制御工学など機械科学コースで学ぶものが中心となる。これらの複数の学問を駆使して、問題の解法よりも問題の設定方法や根本的な考え方に特に重点を置いた説明を行い、ひいては複雑な生体のしくみや運動を理解するためには何が本質となるかを理解する。,1前半の内容・生命編：生き物と機械は何が違うか，動物にはなぜ本能があるか，生き物はなぜそれぞれ違うかand/or同じか，病気とは何か，生命にとって死とは何か，アンドロイドは人間になれるか，物理学者・工学者はなぜ生命を理解しにくいか，なぜ人との付き合いが思い通りにならないか，なぜ心がつらいときがありそれが時間とともに改善されることがあるか，自分や他人がある感情をもつ理由は何か，偉い人の語る若者へのメッセージをどのように聴けばよいかなど，講義中に出されるたくさんの疑問に対して，生命の特徴を理解したうえで論理的に（物理化学の知識を適宜用いて）自分自身で回答できるようにする．後半の内容・力学編：力学的観点に基づく生体の運動に関する議論を通して、上で列挙した諸学問の基盤を改めて詳細に議論してそれらの理解を深めるとともに、生体の解析における機械科学・力学の重要性と発展性および面白さと課題・制限をそれぞれ具体的に説明できるようにする。,四力に関する各講義を受講したことがあること。,,第1回題目:前半・生命編：1. 進化の仕組み2. 生命と熱力学3. 生命の環境適応と多様性後半・力学編：4. 力学の原理15. 力学の原理26. 流体・構造連成7. 自励振動担当教員：授業時間外学習：・毎講義においてショートレポートを課する・最終レポート・議論への参加状況以上を併せて評価する,"後半の内容ではオープンアクセス（入手無料）の下記論文の内容を扱う：Deguchi, S., Mechanism of and threshold biomechanical conditions for falsetto voice onset. PLOS ONE 6(3), e17503, 2011.http://journals.plos.org/plosone/article?id=10.1371/journal.pone.0017503Deguchi, S., A possible common physical principle that underlies animal vocalization: theoretical considerations with an unsteady airflow-structure interaction modelhttps://www.jstage.jst.go.jp/article/jbse/11/4/11_16-00414/_pdf/-char/ja",例えば講義中に下記の一般書に言及します．動的平衡：福岡伸一利己的な遺伝子：リチャード・ドーキンス生命とは何か ― 物理的にみた生細胞：シュレーディンガー人間とは何か：マーク・トウェインアンドロイドは人間になれるか：石黒浩火の鳥2・未来編：手塚治虫,評価方法／Evaluation Methods小テストレポート・論文学習目標1前半の内容・生命編：生き物と機械は何が違うか，動物にはなぜ本能があるか，生き物はなぜそれぞれ違うかand/or同じか，病気とは何か，生命にとって死とは何か，アンドロイドは人間になれるか，物理学者・工学者はなぜ生命を理解しにくいか，なぜ人との付き合いが思い通りにならないか，なぜ心がつらいときがありそれが時間とともに改善されることがあるか，自分や他人がある感情をもつ理由は何か，偉い人の語る若者へのメッセージをどのように聴けばよいかなど，講義中に出されるたくさんの疑問に対して，生命の特徴を理解したうえで論理的に（物理化学の知識を適宜用いて）自分自身で回答できるようにする．後半の内容・力学編：力学的観点に基づく生体の運動に関する議論を通して、上で列挙した諸学問の基盤を改めて詳細に議論してそれらの理解を深めるとともに、生体の解析における機械科学・力学の重要性と発展性および面白さと課題・制限をそれぞれ具体的に説明できるようにする。○○評価割合（%）／Allocation of Marks50%50%,・ショートレポートを数回課する（50%程度）・最終レポートと併せて評価する（50%程度）,本科目の受講に際し特別な配慮を要する場合は、基礎工学研究科の教務係に事前に相談するとともに、初回授業等、早期に授業担当教員に申し出てください。,質問は随時受け付ける。,
090729,春～夏学期,火4,生体情報論,0,講義科目,2.0,"2,3,4年",坂上　友介,非該当,,日本語,聴講・視聴: 講義・教材・実演を視聴して学ぶ（例：講義の対面受講、オンデマンド教材視聴）授業内容についてレポート形式で提出する．,生体工学をはじめとするデータを取り扱う研究の遂行にあたって，データに基づいて何らかの結論を導くためには，統計学を道具として使いこなせることが必須である．本講義では統計データの解析手法を実践的な題材に基づいて習得し，将来，研究に際して実験データの統計処理や検定を実施するにあたって，適切な手法を選択・実施できる知識を得ることを目標とする．,1統計データの解析手法を選択・実施できる．,特になし．,学校感染症や発熱および忌引きなどで出席できない場合は，教務係および担当教員に申し出てください．,第1回題目:統計学概論統計学の概論を学ぶ担当教員：坂上友介授業時間外学習：授業内容に関するレポートをCLEにて提出する．第2回題目:1次元，2次元データの記述統計学記述統計学について学ぶ担当教員：坂上友介授業時間外学習：授業内容に関するレポートをCLEにて提出する．第3回題目:回帰分析回帰分析について学ぶ担当教員：坂上友介授業時間外学習：授業内容に関するレポートをCLEにて提出する．第4回題目:確率と確率分布確率と確率分布について学ぶ担当教員：坂上友介授業時間外学習：授業内容に関するレポートをCLEにて提出する．第5回題目:中心極限定理中心極限定理について学ぶ担当教員：坂上友介授業時間外学習：授業内容に関するレポートをCLEにて提出する．第6回題目:母集団と標本母集団と標本について学ぶ担当教員：坂上友介授業時間外学習：授業内容に関するレポートをCLEにて提出する．第7回題目:区間推定区間推定について学ぶ担当教員：坂上友介授業時間外学習：授業内容に関するレポートをCLEにて提出する．第8回題目:検定の基礎，二群の差の検定検定の基礎と二群の差の検定について学ぶ担当教員：坂上友介授業時間外学習：授業内容に関するレポートをCLEにて提出する．第9回題目:分散分析分散分析について学ぶ担当教員：坂上友介授業時間外学習：授業内容に関するレポートをCLEにて提出する．第10回題目:官能評価官能評価について学ぶ担当教員：坂上友介授業時間外学習：授業内容に関するレポートをCLEにて提出する．第11回題目:一対比較法一対比較法について学ぶ担当教員：坂上友介授業時間外学習：授業内容に関するレポートをCLEにて提出する．第12回題目:多変量解析(主成分分析，判別分析)主成分分析と判別分析について学ぶ担当教員：坂上友介授業時間外学習：授業内容に関するレポートをCLEにて提出する．第13回題目:多変量解析(クラスタリング)クラスタリングについて学ぶ担当教員：坂上友介授業時間外学習：授業内容に関するレポートをCLEにて提出する．第14回題目:統計学と応用数学統計学と応用数学について学ぶ担当教員：坂上友介授業時間外学習：授業内容に関するレポートをCLEにて提出する．第15回題目:生体情報収集の方法論と実問題生体情報収集の方法論と実問題について学ぶ担当教員：坂上友介授業時間外学習：授業内容に関するレポートをCLEにて提出する．,特になし(適宜資料を配布します)．,"・東京大学教養学部統計学教室編: 基礎統計学I - 統計学入門, 東京大学出版会 (1991)・栗原伸一: 入門 統計学 -検定から多変量解析・実験計画法まで-, オーム社 (2011)・長沢伸也, 川栄聡史: Excelでできる統計的官能評価法, 日科技連出版社 (2008)",評価方法／Evaluation Methodsレポート・論文期末試験学習目標1統計データの解析手法を選択・実施できる．○○評価割合（%）／Allocation of Marks30%70%,特になし．,"1. 統計学概論2. 1次元, 2次元データの記述統計学3. 回帰分析4. 確率と確率分布5. 中心極限定理6. 母集団と標本7. 区間推定8. 検定の基礎, 二群の差の検定9. 分散分析10. 官能評価法11. 一対比較法12. 多変量解析（主成分分析，判別分析）13. 多変量解析（クラスタリング）14. 統計学と応用数学15. 生体情報収集の方法論と実問題上記スケジュールは予告なしに変更される場合があります．",火曜日　16:30-17:30 J410(基礎工学研究科),担当教員は、民間企業の研究開発部門にて、研究・製品開発業務に携わった経験があります。この経験を踏まえて、必要に応じて実例を提示しながら、授業を行います。
090391(知のジムナスティックス科目),春～夏学期,月2,生体計測学,0,講義科目,2.0,"3,4年",西本　伸志,非該当,,日本語,聴講・視聴: 講義・教材・実演を視聴して学ぶ（例：講義の対面受講、オンデマンド教材視聴）,心拍計測からイメージング、脳機能計測、心理計測など、生体を対象にした研究開発を進めるために必要な多様な生体計測の基礎、またこれに関連する制度等を学ぶ。,1様々な生体計測の例について、原理から実際までを理解する。,,学校感染症や発熱および忌引きなどで出席できない場合は、教務係および担当教員に申し出てください。,第1回題目:生体計測の基礎担当教員：授業時間外学習：授業中に紹介する各種リソースを参考に理解を深める。第2回題目:計測と記録担当教員：授業時間外学習：授業中に紹介する各種リソースを参考に理解を深める。第3回題目:生理計測（１）担当教員：授業時間外学習：授業中に紹介する各種リソースを参考に理解を深める。第4回題目:生理計測（２）担当教員：授業時間外学習：授業中に紹介する各種リソースを参考に理解を深める。第5回題目:生体イメージング（１）担当教員：授業時間外学習：授業中に紹介する各種リソースを参考に理解を深める。第6回題目:生体イメージング（２）担当教員：授業時間外学習：授業中に紹介する各種リソースを参考に理解を深める。第7回題目:中間試験・まとめ担当教員：授業時間外学習：授業中に紹介する各種リソースを参考に理解を深める。第8回題目:脳機能計測（１）担当教員：授業時間外学習：授業中に紹介する各種リソースを参考に理解を深める。第9回題目:脳機能計測（２）担当教員：授業時間外学習：授業中に紹介する各種リソースを参考に理解を深める。第10回題目:運動計測担当教員：授業時間外学習：授業中に紹介する各種リソースを参考に理解を深める。第11回題目:心理・認知計測担当教員：授業時間外学習：授業中に紹介する各種リソースを参考に理解を深める。第12回題目:生体計測と統計担当教員：授業時間外学習：授業中に紹介する各種リソースを参考に理解を深める。第13回題目:生体計測と社会担当教員：授業時間外学習：授業中に紹介する各種リソースを参考に理解を深める。第14回題目:生体計測の展望担当教員：授業時間外学習：授業中に紹介する各種リソースを参考に理解を深める。第15回題目:期末試験・まとめ担当教員：授業時間外学習：授業中に紹介する各種リソースを参考に理解を深める。,,,評価方法／Evaluation Methods学習への参加度中間試験期末試験学習目標1様々な生体計測の例について、原理から実際までを理解する。○○○評価割合（%）／Allocation of Marks20%30%50%,,,,
090250(知のジムナスティックス科目),秋～冬学期,月1,生物化学工学,0,講義科目,2.0,"3,4年",小嶋　勝,非該当,生物化学工学,日本語,聴講・視聴: 講義・教材・実演を視聴して学ぶ（例：講義の対面受講、オンデマンド教材視聴）,生化学反応過程および微生物の培養過程に関する工学的基礎の理解を目的とする。まず、生体触媒としての酵素や微生物細胞の特性を説明し、化学触媒との相違点を明確にする。さらに、酵素反応や微生物培養の速度論を解説し、酵素反応と微生物培養における操作・方法論および装置設計に関する基礎事項を講述する。また、生体内での代謝反応に関する理解を深めるため、遺伝子レベルおよび酵素反応レベルでの制御メカニズムについても言及する。,1生物が関与する反応および代謝に関する基礎を理解し、それを実際のプロセスやシステムに結び付けるバイオサイエンスとバイオエンジニアリングの素養を身に着けることができる。,特になし。,学校感染症や発熱および忌引きなどで出席できない場合は、教務係および担当教員に申し出てください。,第1回題目:以下の内容について講義するが、あくまでも予定であり、状況に応じて一部を変更することもある。１．生命科学と生物化学工学２．生体触媒としての酵素の特性３．酵素反応の速度論４．酵素反応の操作および装置５．生物の特性と分類６．生物（特に微生物）細胞増殖の速度論７．生体内の代謝反応８．代謝制御工学の基礎９．遺伝子工学の基礎１０．微生物培養の操作論（回分培養）１１．微生物培養の操作論（連続培養）１２．バイオプロセスとバイオリアクター１３．バイオリアクターの設計１４．生物生産物の分離１５．殺菌および無菌操作担当教員：授業時間外学習：各回の授業項目・内容について、配布資料、参考書等を用いて予習復習をしておくこと。必要に応じて、演習問題を宿題とすることもある。,「生物化学工学 第2版」東京化学同人,東稔節治編著「生物化学工学」朝倉書店 1996山根恒夫著「生物反応工学」第３版　産業図書 2002,評価方法／Evaluation Methodsレポート・論文学習への参加度期末試験学習目標1生物が関与する反応および代謝に関する基礎を理解し、それを実際のプロセスやシステムに結び付けるバイオサイエンスとバイオエンジニアリングの素養を身に着けることができる。○○○評価割合（%）／Allocation of Marks50%10%40%,期末試験(40%)、授業への参加態度(10%)及び提出されたレポート(50%)から総合評価する。,本科目の受講に際し特別な配慮を要する場合は、基礎工学研究科の教務係に事前に相談するとともに、初回授業等、早期に授業担当教員に申し出てください。,木曜日　17:00〜18:00,
090489,春～夏学期,金2,生物基礎物理学,0,講義科目,2.0,"2,3,4年","石島　秋彦,福岡　創",非該当,生物基礎物理学,日本語,聴講・視聴: 講義・教材・実演を視聴して学ぶ（例：講義の対面受講、オンデマンド教材視聴）,生命科学を基礎から，方法論まで定量的に理解することを目的とする,1生物学を単に知識として理解するのではなく，数学，統計力学，などを駆使して理解することを目標とする,特になし，初等力学，統計力学を理解していると好ましい,学校感染症や発熱および忌引きなどで出席できない場合は、教務係および担当教員に申し出てください。,第1回題目:1. 生物物理とは？2. 生体分子（糖，脂質，ヌクレオチド，アミノ酸，タンパク質）3. 生化学的手法4. 光学基礎5. 光学顕微鏡6. 蛍光7. タンパク質の機能の一例，筋収縮8. タンパク質の機能の一例，バクテリア9. 1分子イメージング10. 1分子計測担当教員：授業時間外学習：授業終了10分前にミニッツペーパーを配布する．授業における課題，授業内容に対する質問などを記入,特に指定なし,特に指定なし,評価方法／Evaluation Methodsレポート・論文学習への参加度学習目標1生物学を単に知識として理解するのではなく，数学，統計力学，などを駆使して理解することを目標とする○○評価割合（%）／Allocation of Marks70%30%,最終試験　70%授業への参加態度　30%,この教科は，3回生，生物工学演習Ｂ，生物工学実験Bとつながります．本科目の受講に際し特別な配慮を要する場合は、基礎工学研究科の教務係に事前に相談するとともに、初回授業等、早期に授業担当教員に申し出てください。,メールにてコンタクトをとること,
