course_code,semester,day_and_period,course_name_jp,capacity,type_of_class,credits,student_year,instructor,course_of_media_class,course_subtitle,language_of_the_course,learning_methods,course_objectives,learning_goals,requirements_prerequisites,attendance_and_student_conduct_policy,class_plan,textbooks,reference,grading_policy,additional_information_on_grading,special_note,office_hours,course_conducted_by_instructors_with_practical_experience
090323(知のジムナスティックス科目),春～夏学期,火2,反応工学Ｂ,0,講義科目,2.0,"3,4年",西山　憲和,非該当,反応工学B,日本語,聴講・視聴: 講義・教材・実演を視聴して学ぶ（例：講義の対面受講、オンデマンド教材視聴）,化学プラントにおける反応器設計のための工学として成立した反応工学は、今日ではマクロな地球環境問題からミクロな生体内の現象まで、化学反応をともなうさまざまな自然現象を理解し、予測し、操作するための基礎的な枠組を与えるものへと進化している。本講義では、反応工学Ａの知識を前提に、反応工学の基礎に対する充実した知識と技能を身につける事を目的として、講義、ならびに演習を進める。,1不均一反応である気固触媒反応、気液反応、気固反応において、物質移動と熱移動が反応速度にどのように影響を及ぼすかを理解し説明できる。数式のもつ物理的意味を理解し、計算例をもとに、不均一反応系の反応速度の解析と反応装置の設計ができる。,反応工学Ａの知識を前提に講義を行う。,学校感染症や発熱および忌引きなどで出席できない場合は、教務係および担当教員に申し出てください。,第1回題目:不均一系反応の反応器の設計について、主に殻状モデル（気固系）、反応吸収(気液系)、固体触媒反応、を取り扱う。１．不均一系反応の反応器の設計（イントロダクション）担当教員：授業時間外学習：講義で出てきた専門用語等の意味の理解、式の導出などを毎回復習すること。授業の最後で講義内容に関する小テストを行うが、復習し、解けるようにしておくこと。第2回題目:２．不均一系反応の反応速度式担当教員：授業時間外学習：第3回題目:３．気固系反応：殻状モデル担当教員：授業時間外学習：第4回題目:４．気固系反応：殻状モデルの拡張担当教員：授業時間外学習：第5回題目:５．気液系反応：濃度分布と反応速度式担当教員：授業時間外学習：第6回題目:６．気液系反応：反応吸収担当教員：授業時間外学習：第7回題目:７．固体触媒反応：触媒表面での反応速度論担当教員：授業時間外学習：第8回題目:８．固体触媒反応：細孔内拡散担当教員：授業時間外学習：第9回題目:９．固体触媒反応：触媒有効係数担当教員：授業時間外学習：第10回題目:１０．固体触媒反応：非等温系担当教員：授業時間外学習：第11回題目:１１．固体触媒反応：触媒反応器の設計担当教員：授業時間外学習：第12回題目:１２．固体触媒反応：律速段階の決定担当教員：授業時間外学習：第13回題目:１３．気液固触媒反応担当教員：授業時間外学習：第14回題目:１４．その他のトピックス（触媒劣化）担当教員：授業時間外学習：第15回題目:１５．その他のトピックス（充填層、流動層）担当教員：授業時間外学習：,後藤繁雄　編著　「化学反応操作」朝倉書店,東稔節治，浅井悟編｢化学反応工学｣　朝倉書店 1993小宮山宏著 ｢反応工学　反応装置から地球まで｣　培風館 1995Octave Levenspiel「Chemical Reaction Engineering」3rd Ed.John Wiley & Sons,評価方法／Evaluation Methods中間試験期末試験学習への参加度学習目標1不均一反応である気固触媒反応、気液反応、気固反応において、物質移動と熱移動が反応速度にどのように影響を及ぼすかを理解し説明できる。数式のもつ物理的意味を理解し、計算例をもとに、不均一反応系の反応速度の解析と反応装置の設計ができる。○○○評価割合（%）／Allocation of Marks40%40%20%,原則として中間および期末試験をもって判定する。 授業への参加態度、レポート提出も評価する。授業への参加態度およびレポート　20％中間試験および期末試験80%,本科目の受講に際し特別な配慮を要する場合は、基礎工学研究科の教務係に事前に相談するとともに、初回授業等、早期に授業担当教員に申し出てください。,金曜日　17:00-18:00,
090165,通年,"月4,月5,木3,木4,木5,金3,金4",合成化学実験,0,実験科目,6.0,"3,4年","廣瀬　敬治,清水　章弘,川守田　創一郎,鈴木　修一,桶谷　龍成,藤井　郁哉,各教員",非該当,合成化学実験,日本語,聴講・視聴: 講義・教材・実演を視聴して学ぶ（例：講義の対面受講、オンデマンド教材視聴）読解: 本や論文を読解して学ぶ（例：論文要約、ウェブ情報の読解）討論: 学生同士や教員との間で質疑応答や意見交換を行うことで学ぶ（例：ペア・グループディスカッション、オンラインでのチャット、論文個別指導）協同: ペアやグループで行う協同作業を通して学ぶ（例：グループによるポスター制作）調査: 本や論文から情報を収集したり、フィールドワークでデータを収集・分析して学ぶ（例：先行研究整理、フィールドワーク）体験・実践: 体験・実践等の行動ならびにそれに対するフィードバックにより学ぶ（例：問題演習、機器等を使う実験、学内外実習、スポーツ等の実技、課題解決型学習、インターンシップ）発表: 執筆、プレゼンテーション、作品制作等により学ぶ（例：レポート作成、プレゼンテーション、ポスター発表、作品制作、ポートフォリオ）,有機化合物、高分子化合物の合成を実際に行うことによって有機化学、高分子化学の講義で学んだ知識を身に付いたものにする。特に引火性、発火性物質を扱うことの多い有機合成実験では、用いる試剤の性質をよく調べ、実験操作手順を熟知し、安全で、確実で、かつ能率のよい実験方法を修得する必要がある。また、実験を通して蒸留、再結晶、抽出などの単位操作や、クロマトグラフィー、ＮＭＲ、ＩＲなどの機器による分析に習熟する。,1本講義を履修した学生は次のことに取り組み、自らが出来ようになる。1. 用いる試剤の性質の調査22. 実験操作手順の熟知と安全で、確実で、かつ能率のよい実験方法の実施と修得33. 蒸留、再結晶、抽出などの単位操作の実施と修得44. クロマトグラフィー、ＮＭＲ、ＩＲなどの機器による分析の実施と習熟,有機化学、高分子化学の基礎を修得していること。,学校感染症や発熱および忌引きなどで出席できない場合は、教務係および担当教員に申し出てください。,"第1回題目:講義１．単位操作（蒸留、抽出、再結晶など）２．実習テーマ説明テーマ１．シクロヘキサノンの合成テーマ２．ｐ-ニトロアニリンの合成テーマ３．安息香酸エチルおよびトリフェニルメタノールの合成テーマ４．１-フェニルエチルアミンの光学分割テーマ５．ポリ酢酸ビニル、ポリビニルアルコール、ポリ桂皮酸ビニルの合成３．文献調査（ケミカルアブストラクツの検索法など）担当教員：清水章弘授業時間外学習：講義予定時間外に1時間を目安に予復習すること第2回題目:実習テーマ１．シクロヘキサノンの合成1-1シクロヘキサノールの酸化シクロヘキサノール/クロム酸ナトリウム/メタノール抽出、蒸留、GC、IR、1HNMR1-22,4-ジニトロフェニルヒドラジンとの縮合2,4-ジニトロフェニルヒドラジン/エタノール/硫酸再結晶、融点測定、IR、1HNMR1-3シクロヘキサンノンのＯ-シリル化（1-トリメチルシリルオキシシクロヘキセンの合成）ジイソプロピルアミン/BuLi/THF/TMSCl低温・不活性ガス雰囲気での反応、GC、1HNMR担当教員：清水章弘授業時間外学習：実験予定時間外に1時間を目安に予復習すること第3回題目:実習テーマ２．ｐ-ニトロアニリンの合成2-1アニリンのアセチル化アニリン塩酸塩/無水酢酸/酢酸ナトリウム吸引ろ過、再結晶、融点測定2-2アセトアニリドのニトロ化,加水分解,異性体混合物からの単離硝酸/硫酸/アンモニア再結晶、融点測定、TLC、1HNMR担当教員：清水章弘授業時間外学習：実験予定時間外に1時間を目安に予復習すること第4回題目:実習テーマ３．安息香酸エチルおよびトリフェニルメタノールの合成3-1安息香酸のエステル化安息香酸/エタノール/硫酸抽出、TLC、減圧蒸留、IR、1HNMR3-2Grignard反応ブロモベンゼン/Mg/エーテル(ジエチルエーテル)3-3トリフェニルメタノール再結晶、1HNMR、TLC担当教員：清水章弘授業時間外学習：実験予定時間外に1時間を目安に予復習すること第5回題目:実習テーマ４．１-フェニルエチルアミンの光学分割4-1ラセミ体フェニルエチルアミンと光学活性酒石酸の塩の生成1-フェニルエチルアミン/酒石酸/メタノール優先晶出、抽出4-2光学活性1-フェニルエチルアミンのアセチル化酢酸/EDC・HCl/THF融点測定、HPLC、旋光度担当教員：清水章弘授業時間外学習：実験予定時間外に1時間を目安に予復習すること第6回題目:実習テーマ５．ポリ酢酸ビニル、ポリビニルアルコール、ポリ桂皮酸ビニルの合成5-1VAc のラジカル重合によるポリ酢酸ビニル(PVAc)の合成酢酸ビニル/ゼラチン/BPO常圧蒸留、懸濁重合5-2PVAcの加水分解(PVA の合成)NaOH/メタノールフィルム作成、IR5-3ポリ桂皮酸ビニルの合成とその光架橋反応シンナモイルクロリド遮光反応、光反応担当教員：清水章弘授業時間外学習：実験予定時間外に1時間を目安に予復習すること",担当教員が準備する実験用冊子。「第８版　実験を安全に行うために」化学同人 2017「第４版　続実験を安全に行うために」化学同人 2017「化学を学ぶ人のレポート・論文・発表マスターガイド」化学同人　2010,"「有機化学実験のてびき　１，２，３，４，５」化学同人　1988-1991「第２版　機器分析のてびき　１,２,３,データ集」化学同人 1996「第４版　化学文献の調べ方」化学同人 1995「化学文献とデータベースの活用法」化学同人 2002",評価方法／Evaluation Methodsレポート・論文口頭試問発表実技・実演学習への参加度学習目標1本講義を履修した学生は次のことに取り組み、自らが出来ようになる。1. 用いる試剤の性質の調査○○○○○学習目標22. 実験操作手順の熟知と安全で、確実で、かつ能率のよい実験方法の実施と修得○○○○○学習目標33. 蒸留、再結晶、抽出などの単位操作の実施と修得○○○○○学習目標44. クロマトグラフィー、ＮＭＲ、ＩＲなどの機器による分析の実施と習熟○○○○○評価割合（%）／Allocation of Marks20%10%10%50%10%,講義内容に関する試験、授業参加（出席は加点対象ではありません。無断欠席など、正当な理由によらず欠席した場合は減点対象とします）、面接とレポート。,講義１．単位操作（蒸留、抽出、再結晶など）２．実習テーマ説明３．文献調査（ケミカルアブストラクツの検索法など）実習１．シクロヘキサノンの合成２．ｐ-ニトロアニリンの合成３．１-フェニルエチルアミンの光学分割４．安息香酸エチルおよびトリフェニルメタノールの合成５．ポリ酢酸ビニル、ポリビニルアルコール、ポリ桂皮酸ビニルの合成本科目の受講に際し特別な配慮を要する場合は、基礎工学研究科の教務係に事前に相談するとともに、初回授業等、早期に授業担当教員に申し出てください。尚、状況によっては実施する実験を制限する可能性があります。,金曜日　12時-13時,
090663(知のジムナスティックス科目),春学期,金3,回路理論 I,0,講義科目,1.0,"2,3,4年",阿部　真之,非該当,回路理論I,日本語,,電気回路の理論は電気・電子工学、通信・情報工学、制御工学等を学ぶものにとって最も重要な基礎科目の一つである。主として線形、受動、相反な集中定数回路を対象として、電気回路の理解を深める。,1電気回路の問題を理解できるようになる。,複素数の取り扱い、線形代数等についてしっかりと勉強しておくこと。各自、ノートPCを持ってきてください。レポート作成作業も提出もノートPCから行ってもらいます。,学校感染症や発熱および忌引きなどで出席できない場合は、教務係および担当教員に申し出てください。,第1回題目:第１回　基本素子第２回　キルヒホッフの法則第３回　回路と微分方程式第４回　回路の諸定理第５回　交流回路第６回　交流回路第７回　回路におけるグラフ第８回　期末試験＋総括担当教員：授業時間外学習：（１）事前に配布している電子ファイルで予習を行うこと。（２）指定されている教科書の演習問題を解くこと。,（教科書）小澤孝夫「電気回路I基礎・交流編」朝倉書店（参考書）阿部真之・土岐博「電気回路と伝送線路の基礎」丸善,上記の教科書に示してある。,評価方法／Evaluation Methods小テスト期末試験学習目標1電気回路の問題を理解できるようになる。○○評価割合（%）／Allocation of Marks20%80%,毎回実施する小テストと期末試験で評価する。欠席が多いものは評価外とする。,本科目の受講に際し特別な配慮を要する場合は、基礎工学研究科の教務係に事前に相談するとともに、初回授業等、早期に授業担当教員に申し出てください。,金曜日14:40-15:40,
090664,夏学期,金3,回路理論 II,0,講義科目,1.0,"2,3,4年",阿部　真之,非該当,回路理論II,日本語,聴講・視聴: 講義・教材・実演を視聴して学ぶ（例：講義の対面受講、オンデマンド教材視聴）,電気回路の理論は電気・電子工学、通信・情報工学、制御工学等を学ぶものにとって最も重要な基礎科目の一つである。主として線形、受動、相反な集中定数回路を対象として、電気回路の理解を深める。,1電気回路の問題を理解できるようになる。,複素数の取り扱い、線形代数等についてしっかりと勉強しておくこと。各自、ノートPCを持ってきてください。レポート作成作業も提出もノートPCから行ってもらいます。,学校感染症や発熱および忌引きなどで出席できない場合は、教務係および担当教員に申し出てください。,第1回題目:第１回　回路網方程式第２回　回路網方程式第３回　結合素子第４回　結合素子第５回　三相交流回路第６回　２端子素子第７回　２端子素子第８回　期末試験＋総括担当教員：授業時間外学習：（１）事前に配布している電子ファイルで予習を行うこと。（２）指定されている教科書の演習問題を解くこと。,（教科書）小澤孝夫「電気回路I基礎・交流編」朝倉書店（参考書）阿部真之・土岐博「電気回路と伝送線路の基礎」丸善,上記の教科書に示してある。,評価方法／Evaluation Methods小テスト期末試験学習目標1電気回路の問題を理解できるようになる。○○評価割合（%）／Allocation of Marks20%80%,毎週実施する小テストと期末試験で評価する。欠席が多いものは評価の対象外とする。,本科目の受講に際し特別な配慮を要する場合は、基礎工学研究科の教務係に事前に相談するとともに、初回授業等、早期に授業担当教員に申し出てください。,金曜日14:40-15:40,
090097,秋学期,火3,回路理論 III,0,講義科目,1.0,"2,3,4年",冨士田　誠之,非該当,,日本語,聴講・視聴: 講義・教材・実演を視聴して学ぶ（例：講義の対面受講、オンデマンド教材視聴）,電気回路の理論は電気・電子工学，通信・情報工学，制御工学等を学ぶものにとって最も重要な基礎科目の一つである．本講義では，主として線形・受動・相反な集中定数回路を対象として，ラプラス変換を学び，電気回路の理解を深める．,1電気回路の問題，特にラプラス変換を利用した解法を理解できるようになる．,複素数の取り扱い，線形代数等について，学習しておくこと．,,第1回題目:回路における過渡応答担当教員：授業時間外学習：教科書，配布資料に基づき復習すること第2回題目:ラプラス変換担当教員：授業時間外学習：教科書，配布資料に基づき復習すること第3回題目:ラプラス変換担当教員：授業時間外学習：教科書，配布資料に基づき復習すること第4回題目:ラプラス変換担当教員：授業時間外学習：教科書，配布資料に基づき復習すること第5回題目:ラプラス変換による回路の解法担当教員：授業時間外学習：教科書，配布資料に基づき復習すること第6回題目:ラプラス変換による回路の解法担当教員：授業時間外学習：教科書，配布資料に基づき復習すること第7回題目:ラプラス変換による回路の解法担当教員：授業時間外学習：教科書，配布資料に基づき復習すること第8回題目:定期試験と総括担当教員：授業時間外学習：定期試験に対応した学習をすること,小澤孝夫「電気回路II 過渡現象・伝送回路編」朝倉書店,川村 雅恭「ラプラス変換と電気回路」コロナ社武部 幹「回路の応答」コロナ社,評価方法／Evaluation Methods期末試験学習目標1電気回路の問題，特にラプラス変換を利用した解法を理解できるようになる．○評価割合（%）／Allocation of Marks100%,期末試験を基本とするが，状況により，小テストやレポート課題等を課し，考慮する可能性がある．,本科目の受講に際し特別な配慮を要する場合は、基礎工学研究科の教務係に事前に相談するとともに、初回授業等、早期に授業担当教員に申し出てください。,講義終了後，または個別の連絡に対応しますので担当教員と相談のこと．,
090098,冬学期,火3,回路理論 IV,0,講義科目,1.0,"2,3,4年",中田　陽介,非該当,回路理論 IV,日本語,聴講・視聴: 講義・教材・実演を視聴して学ぶ（例：講義の対面受講、オンデマンド教材視聴）,対象となる物理系に所定の操作を加え目的の機能を実現することを「制御」と呼ぶ。本講義では、こうした制御を行うために必要な制御理論の基礎を習得する。特にこれまでに学んできた回路を含むより広い概念である「システム」を対象にその振舞いを制御する手法について学ぶ。制御理論は、実際の機器設計のみならず、あらゆる工学における普遍的な考え方の基礎となるため重要である。,1制御理論の基礎を習得する。,ラプラス変換についてしっかり復習しておくこと。,,第1回題目:ブロック線図教科書 1、2章担当教員：授業時間外学習：(1) 教科書の復習(2) 教科書の演習問題を解く(3) レポート課題のCLEでの提出第2回題目:ラプラス変換 (復習)教科書 3章担当教員：授業時間外学習：(1) 教科書の復習(2) 教科書の演習問題を解く(3) レポート課題のCLEでの提出第3回題目:フィードバック制御教科書 4章担当教員：授業時間外学習：(1) 教科書の復習(2) 教科書の演習問題を解く(3) レポート課題のCLEでの提出第4回題目:周波数応答教科書 5章担当教員：授業時間外学習：(1) 教科書の復習(2) 教科書の演習問題を解く(3) レポート課題のCLEでの提出第5回題目:安定性教科書 6章担当教員：授業時間外学習：(1) 教科書の復習(2) 教科書の演習問題を解く(3) レポート課題のCLEでの提出第6回題目:特性補償教科書 7章担当教員：授業時間外学習：(1) 教科書の復習(2) 教科書の演習問題を解く(3) レポート課題のCLEでの提出第7回題目:状態方程式教科書 8章担当教員：授業時間外学習：(1) 教科書の復習(2) 教科書の演習問題を解く第8回題目:まとめ・試験教科書 1 〜 8章担当教員：授業時間外学習：,中野 道雄、 美多 勉／制御基礎理論 -古典から現代まで-／コロナ社／978-4339032130,南 裕樹／Pythonによる制御工学入門／オーム社／978-4274223907,評価方法／Evaluation Methods期末試験学習目標1制御理論の基礎を習得する。○評価割合（%）／Allocation of Marks100%,テスト前を除き、毎回、レポート課題を課します。レポートの提出率が75%未満の場合は成績評価の対象外となります。,本授業はハイフレックス形式で行なうが、半分以上の授業時数を対面で受講する必要がある。復習のため毎回のビデオとスライドをCLEを経由して配布する。本科目の受講に際し特別な配慮を要する場合は、基礎工学研究科の教務係に事前に相談するとともに、初回授業等、早期に授業担当教員に申し出てください。,CLEのメール機能で連絡してください。日程調整の上、対応します。,
